PlaceName,Category,Type,Location,Country,MapsUrl,CityMapperUrl,GeoJSON,Latitude,Longitude,Long Name,Short Name,Address,PointType,PlaceId,WikipediaSearchQuery,ForcePageId,WikipediaLanguage,WikipediaUrl,WikiTitle,PageId,Snippet,Source,Image1,Image2,Image3,Image4,PlaintextTitle,PlaintextContent,Icon,IconUrl,IconImage,IconFillColor,iconBorderColor
Cerro Alegre,site,neighbourhood,Valparaiso,Chile,https://www.google.com/maps/search/?api=1&query=Cerro%20Alegre%20P.%C2%BA%20Dimalow%20290%2C%202371566%20Valpara%C3%ADso%2C%20Chile,"https://citymapper.com/directions?endcoord=-33.0431013,-71.6279286&endname=Cerro%20Alegre","{""plus_code"":{""global_code"":""47RCX94C+QR"",""compound_code"":""X94C+QR Valparaíso, Chile""},""types"":[""establishment"",""point_of_interest""],""address_components"":[{""long_name"":""290"",""short_name"":""290"",""types"":[""street_number""]},{""long_name"":""Paseo Dimalow"",""short_name"":""P.º Dimalow"",""types"":[""route""]},{""long_name"":""Valparaíso"",""short_name"":""Valparaíso"",""types"":[""locality"",""political""]},{""long_name"":""Valparaíso"",""types"":[""administrative_area_level_3"",""political""],""short_name"":""Valparaíso""},{""short_name"":""Valparaiso"",""types"":[""administrative_area_level_2"",""political""],""long_name"":""Valparaiso""},{""types"":[""administrative_area_level_1"",""political""],""short_name"":""Valparaíso"",""long_name"":""Valparaíso""},{""types"":[""country"",""political""],""long_name"":""Chile"",""short_name"":""CL""},{""short_name"":""2371566"",""types"":[""postal_code""],""long_name"":""2371566""}],""place_id"":""ChIJ0ZoN7y7hiZYRFPyPwB0iPx0"",""formatted_address"":""P.º Dimalow 290, 2371566 Valparaíso, Chile"",""geometry"":{""location_type"":""ROOFTOP"",""viewport"":{""southwest"":{""lng"":-71.6292686302915,""lat"":-33.0445100802915},""northeast"":{""lat"":-33.0418121197085,""lng"":-71.6265706697085}},""location"":{""lng"":-71.6279286,""lat"":-33.0431013}}}",-33.0431013,-71.6279286,Paseo Dimalow,P.º Dimalow,"P.º Dimalow 290, 2371566 Valparaíso, Chile",ROOFTOP,ChIJ0ZoN7y7hiZYRFPyPwB0iPx0,cerro alegre paseo dimalow valparaiso chile,,es,https://es.wikipedia.org/?curid=795967,Cerro Alegre,795967,"<span class=""searchmatch"">Cerro</span> <span class=""searchmatch"">Alegre</span> es un barrio de la ciudad de <span class=""searchmatch"">Valparaíso</span>, <span class=""searchmatch"">Chile</span> y se encuentra sobre el centro político y financiero de la ciudad. Su nombre se debe a los",QUERY,https://upload.wikimedia.org/wikipedia/commons/a/a4/Ascensor_El_Peral%2C_tipo_funicular%2C_a%C3%B1o_1902%2C_Valpara%C3%ADso%2C_Chile.jpg,https://upload.wikimedia.org/wikipedia/commons/7/7a/El_Peral.jpg,https://upload.wikimedia.org/wikipedia/commons/9/9e/Grafiti_Valpo_07.3.jpg,https://upload.wikimedia.org/wikipedia/commons/4/47/Palacio_Baburizza_03.jpg,Cerro Alegre,"# Cerro Alegre
---

Cerro Alegre es un barrio de la ciudad de Valparaíso, Chile y se encuentra sobre el centro político y financiero de la ciudad. Su nombre se debe a los bellos jardines que adornaban las casas del sector, que en el siglo XIX estaba habitado principalmente por inmigrantes ingleses. 
Formula una unidad geográfica y cultural con el vecino Cerro Concepción. Cerro Alegre es barrio de un conjunto de sitios atractivos, como restaurantes, miradores, hoteles de lujo, hostales y otros alojamientos más tradicionales. 


## Geografía El barrio de Cerro Alegre está comprendido por las calles Almirante Montt y José Tomás Ramos en sus extremos laterales, Calle Prat en su extremo inferior y calle Carlos Pezoa Veliz en su extremo superior. Limita con los barrios Puerto y Cerro Cordillera hacia el norte, Financiero y el centro de Valparaíso hacia el este, Cerro Cárcel hacia el sur y Playa Ancha Alto hacia el oeste.
Tiene una superficie de unos 0,7 km² y una población de 6 124 habitantes según el censo del 2017. Su densidad de población es de 15 310 habitantes/km².


## Historia Distinguidos capitanes de la conquista fueron los primeros habitantes del cerro Alegre, cuyos terrenos correspondían a una de las mercedes otorgadas por Pedro de Valdivia a oficiales que encabezaban las tropas en las diferentes campañas. Los capitanes Juan Rodrigo de Guzmán y Nicolás Octavio fueron los primeros españoles en instalarse en el cerro. En 1672, ambos donaron sus terrenos a la orden de los agustinos; medio siglo después, en 1724, el prior Miguel Arrué los vendió nuevamente a un militar, al capitán Luis García Venegas.[1]​
En 1822,el comerciante William Bateman construyó la primera casa y un camino para subir. Le siguió John Martin, también británico. Tras el terremoto de 1822, se comenzó a construir casonas de estilo arquitectónico inglés y una iglesia protestante. El barrio fue poblado por la naciente burguesía comerciante local, en su mayoría británicos y alemanes.
En la segunda mitad del siglo XIX, vivían en Cerro Alegre Samuel Oxley, Jorge Rose Innes, los comerciantes Templeman y David Allerdice, el constructor de barcos Juan Atkinson y el presbiteriano David Trumbull.
Tras la independencia, los porteños criollos lo llamaban cerro Alegre, y los ingleses residentes Mount Pleasent. Se le conoció también como cerro de los Judíos. Para llegar al cerro desde el puerto, se debía subir por la Quebrada de San Agustín (actual Calle José Tomás Ramos), y luego subir por el Camino de los Aguadores, actual calle Estanque.
En 1857 se fundó el Colegio Inglés Mc Kay en calle del Hospital (actual Guillermo Munnich), el colegio inglés más antiguo de Chile y posteriormente, el Saint Margaret's British School for Girls. En 1877, se crea el Colegio de Nuestra Señora de la Misericordia y el Hospital Alemán, en el espacio que ocupó la Quinta Buchnann, obra de la colonia alemana de la ciudad y segundo hospital alemán de Sudamérica. En 1901, los residentes del barrio descendientes de ingleses, fundaron la décima primera CompañÍa de Bomberos ""George Garland"". Su cuartel estuvo en Montealgre, detrás de la parroquia.
En 1909 se funda el club deportivo Everton en la casa de David Foxley. Este equipo de fútbol se trasladó a Viña del Mar debido a que la Asociación Central de Fútbol solo aceptaba un equipo oficial por ciudad. En 1991, por iniciativa del Rotary Club de Valparaíso, se crea el Centro de Capacitación Laboral ""Agustín Turner"".


## Sitios de interés 
## Cerro Concepción =El cerro Concepción es en conjunto uno de los lugares más atractivos y turísticos de Valparaíso con restaurantes y miradores como el Paseo Mirador Atkinson y el Paseo Gervasoni. En este último se encuentra el ascensor Concepción, el primero de la ciudad. El sector toma su nombre por el Castillo Concepción, construido en 1676 en donde actualmente se encuentra el paseo Atkinson. Este cerro sirvió de unión del puerto de Valparaíso con el barrio El Almendral cuando aún no se ganaba terreno al mar. Fue uno de los primeros sectores altos de la ciudad en ser poblado.

## Montealegre =En este sector se ubican casonas de carácter señorial. Vivió aquí el cirujano naval escocés Tomás Leighton, cuya calle de residencia fue renombrada en su honor. En calle Leighton vivió la familia Fontaine, Federico Rudolph, Alberto Karlezi y el senador Pedro Ibáñez Ojeda. Sobre calle Montealegre estaba la casa de la familia Karlsrusher, donde viviría posteriormente el alcalde Sergio Vuskovic. Otros vecinos ilustres del sector Montealegre fueron Arturo Vorwerk Klee, Sara Vial de los Heros, Thomas Somerscales, Medardo Espinoza, Rafael Luis Barahona, Lucía D'Ambra, la familia Vianello y Héctor Radrigán.

## Paseo Yugoslavo =El paseo Yugoslavo es el lugar más representativo de cerro Alegre. Está ubicado a 45 metros sobre el nivel del mar en la salida de la estación superior del ascensor El Peral. Se encuentran aquí el Palacio Astoreca y el Museo de Bellas Artes de Valparaíso en las dependencias del Palacio Baburizza. 
Anteriormente era conocido como Paseo Americano. La casas construidas en este sector remontan de afines del siglo XIX y principios del siglo XX, las cuales fueron financiadas con las fortunas obtenidas del salitre. Entre las ricas familias salitreras que se asentaron en el Paseo Yugoslavo se encuentran los Baburizza, los Zanelli, los Astoreca y los Antoncich.
En 1916 se construyó el palacio de la familia Zanelli, el cual fue comprado en 1925 por Pascual Baburizza. En 1928, se remodeló el paseo a manos del arquitecto Vicente Callovich. 


## Cultura 
## Deportes =El deporte más popular en Cerro Alegre fue el baloncesto. En 1912, nació la organización New Crusaders, que tuvo su mayor éxito en 1950 tras derrotar a Unión Española, campeón durante 25 años seguidos del campeonato local y representantes de Chile en los Juegos Olímpicos de Berlín. Sus jugadores más destacados eran Hernán Raffo y Ortega. En su época del oro, el club tuvo ramas de atletismo, fútbol, natación y waterpolo. La cancha de basquetbol fue construida en 1958 y está al final del pasaje Santa Victorina.
En lo que respecta al fútbol, el club deportivo Everton de Viña del Mar fue creado en Cerro Alegre. En atletismo, una de las figuras más destacadas fue Francisco Allen, quien rompió el récord sudamericano de 3000 metros con obstáculos el 21 de mayo de 1989.

## Educación =Establecimientos de educación básica:

Escuela Básica Montessori
Escuela Particular San Luis
Colegio Bordemar
Establecimientos de educación media:

Liceo N°21 Pedro Montt
Colegio Mar Abierto
Colegio Montessori
Colegio Nuestra Señora de la Misericordia
Colegio Puerto Paz
Colegio Internacional Valparaíso
Establecimientos de educación superior:

Instituto de Música de la Pontificia Universidad Católica de Valparaíso
Centro de Capacitación Laboral ""Agustín Turner""

## Iglesias y parroquias =Parroquia de San Luis Gonzaga.
Iglesia Luterana de la Santa Cruz.
Capilla San Luis.
Catedral Anglicana de San Pablo.
Iglesia de Jesucristo de los Santos de los Últimos Días, estaca Cerro Alegre.

## Artes =Ubicada a la salida de la estación superior del ascensor Reina Victoria, la plazoleta Lukas, después de remodelada en 2014, se ha convertido en un especie de museo al aire libre en homenaje al famoso dibujante Renzo Pecchenino. Con apoyo de la Municipalidad de Valparaíso y la Fundación Lukas, los artistas Cynthia Aguilera (que también firma sola como Cines) y Sammy Espinoza (Jekse o Jehkse), dúo que firma sus grafitis como Unkolordistinto, han recreado los personajes del Bestiario del Reyno de Chile en los muros y tiendas de la pequeña plaza.[2]​
Desde ella se abren hermosas vistas del vecino cerro Concepción y, particularmente, de su iglesia luterana de La Santa Cruz. Aquí comienza el paseo Dimalow, con su hotel boutique Casa Vander, que da a la plazoleta y cuya cara norte, que mira al ascensor, está adornada en su parte inferior con el largo mural La gallada, personajes de Lukas pintados por Unkolordistinto.[2]​ 
El paseo Dimalow es famoso tanto por las vistas que se aprecian desde él como por los murales que se pueden admirar al recorrerlo, entre los que destaca el inmenso personaje pintado por La Robot de Madera (se ve desde el comienzo del paseo, a la derecha, en la cara norte de un edificio), que tiene en su pecho una torre en llamas. Dimalow termina en la calle Almirante Montt, la que, a la derecha, conduce a la iglesia anglicana de San Pablo, que marca el comienzo del cerro Concepción.
La estación superior del ascensor El Peral —cerrado por un año a partir del 1 de junio de 2015 para una ""recuperación integral""—[3]​ da a la calle del mismo nombre; a pocos pasos, a la izquierda, comienza el paseo Yugoslavo, con el magnífico Palacio Baburizza, sede del Museo Municipal de Bellas Artes, que tiene una valiosa colección de obras de artistas nacionales y extranjeros. Desde el paseo, que fue uno de los primeros miradores del puerto, se abre una bella panorámica de la bahía de Valparaíso. En este paseo, en la esquina oriente del Baburizza, está la calle Montealegre, que conecta con el cerro Concepción. 
En la calle Galos esquina Templeman, se encuentra la iglesia de san Luis de Gonzaga (conocida simplemente también como iglesia San Luis y oficialmente como Parroquia San Luis de Gonzaga), fundada en 1890 por los padres palotinos irlandeses ante la necesidad de contar con un lugar de culto católico en un sector poblado por inmigrantes que ya tenían el citado templo anglicano y el luterano de la Santa Cruz, ambos en el vecino cerro Concepción. Juana Ross de Edwards donó los terrenos para su construcción en 1890, que estuvo a cargo del arquitecto Nicanor Marambio[4]​ y que duró dos años y medio: fue inaugurada el 8 de marzo de 1893.[5]​ Después, desde 1934 y 1965, fue de los palotinos alemanes; fueron ellos, concretamente el párraco Clemente Klepper en 1935, quien la hizo partícipe del Movimiento apostólico de Schönstatt. Detrás de la iglesia está la plazuela San Luis, punto importante de conjunción de 6 calles: Almirante Montt, Capilla, Montealegre, Alemania, Múnich y Estanque. Junto con la parroquia, se fundó la Escuela San Luis, en la calle Cirilo Armstrong, que en un comienzo era solo de hombres; hoy es mixto


## Transporte 
## Ascensores =Se puede acceder a Cerro Alegre desde el centro mediante:
Ascensor Reina Victoria, inaugurado en 1902, con su estación baja en calle Elías y estación alta en paseo Dimalow, permite conectar Cerro Alegre con el centro de Valparaíso.
Ascensor Concepción, inaugurado en 1883, con su estación baja en calle Prat y estación alta en paseo Gervasoni, permite conectar Cerro Concepción con el barrio Financiero.
Ascensor El Peral, inaugurado en 1902, con su estación baja en Plaza Justicia y estación alta en paseo Yugoslavo, permite conectar Cerro Alegre con el barrio Puerto.

## Transporte Metropolitano de Valparaíso =Cerro Alegre es un de los barrios con menor conectividad del Gran Valparaíso puesto que ninguna línea de autobús transita por el centro comercial y turístico del barrio. Sin embargo en el sector alto del barrio pasan las siguientes líneas:

514 [Portales - Playa Ancha], por calle El Manzano
515 [Portales - Playa Ancha], por Avenida Alemania
607 [Reñaca - Cárcel Valparaíso], por Avenida Alemania
612 [Viña del Mar - Playa Ancha], por Avenida Alemania
613 [Viña del Mar - Playa Ancha], por Avenida Alemania

## Taxis y colectivos =En Plaza Aníbal Pinto existe un paradero de taxis que suben a Cerro Alegre. A un costado existe un paradero de taxis colectivo que unen el centro de Valparaíso, Cerro Alegre y Playa Ancha Alto. También existe una línea de colectivo que une el barrio con el Rodoviario.


## Referencias 

## Enlaces externos  Wikimedia Commons alberga una categoría multimedia sobre Cerro Alegre.
The Mackay School
Guía de Navegación Cerros.",j05edJz5Xwy0,https://img.icons8.com/?size=150&id=j05edJz5Xwy0,,#fc7965,#643028
Plaza Sotomayor,cultural_site,monument,Valparaiso,Chile,https://www.google.com/maps/search/?api=1&query=Plaza%20Sotomayor%20Sotomayor%2C%20Valpara%C3%ADso%2C%20Chile,"https://citymapper.com/directions?endcoord=-33.0384959,-71.6282501&endname=Plaza%20Sotomayor","{""address_components"":[{""long_name"":""Sotomayor"",""types"":[""route""],""short_name"":""Sotomayor""},{""long_name"":""Valparaíso"",""types"":[""locality"",""political""],""short_name"":""Valparaíso""},{""long_name"":""Valparaíso"",""types"":[""administrative_area_level_3"",""political""],""short_name"":""Valparaíso""},{""types"":[""administrative_area_level_2"",""political""],""short_name"":""Valparaiso"",""long_name"":""Valparaiso""},{""types"":[""administrative_area_level_1"",""political""],""long_name"":""Valparaíso"",""short_name"":""Valparaíso""},{""long_name"":""Chile"",""short_name"":""CL"",""types"":[""country"",""political""]}],""geometry"":{""location"":{""lat"":-33.0384959,""lng"":-71.6282501},""viewport"":{""southwest"":{""lat"":-33.0396986302915,""lng"":-71.6297472302915},""northeast"":{""lng"":-71.6270492697085,""lat"":-33.0370006697085}},""location_type"":""GEOMETRIC_CENTER"",""bounds"":{""northeast"":{""lat"":-33.03761430000001,""lng"":-71.6272857},""southwest"":{""lat"":-33.039085,""lng"":-71.62951079999999}}},""place_id"":""ChIJac7f-CzhiZYRupBFh-Cfg58"",""types"":[""route""],""formatted_address"":""Sotomayor, Valparaíso, Chile""}",-33.0384959,-71.6282501,Sotomayor,Sotomayor,"Sotomayor, Valparaíso, Chile",GEOMETRIC_CENTER,ChIJac7f-CzhiZYRupBFh-Cfg58,plaza sotomayor valparaiso chile,,en,https://en.wikipedia.org/?curid=54319937,Plaza Sotomayor,54319937,"The <span class=""searchmatch"">Plaza</span> <span class=""searchmatch"">Sotomayor</span> is a <span class=""searchmatch"">plaza</span> in <span class=""searchmatch"">Valparaíso</span>, <span class=""searchmatch"">Chile</span>. It is named after Rafael <span class=""searchmatch"">Sotomayor</span>. The square is lined by buildings occupying full block-fronts",QUERY,https://upload.wikimedia.org/wikipedia/commons/3/3c/Monumento_H%C3%A9roes_Iquique.jpg,,,,Plaza Sotomayor,"# Plaza Sotomayor
---

The Plaza Sotomayor is a plaza in Valparaíso, Chile. It is named after Rafael Sotomayor. The square is lined by buildings occupying full block-fronts of the streets that flank it. The focus of the square is the monument that honors the Chilean sailors who fell during the Battle of Iquique and the Battle of Punta Gruesa. The plaza and surrounding buildings was designated a Zona Típica (historic district) on January 23, 1979.

At the northeastern side of the square are two similar towers, which create a sort of gate entrance to the port from the city. On the opposite side is the building that housed the Intendencia de Valparaíso, which currently is home to the headquarters of the Chilean Navy. The building used by the CSAV and the building that houses the National Council of Culture and the Arts also face the plaza.
Close to the station is the western terminus station of the Valparaíso Metro, that replaced the old railway station.


## History Sotomayor Square originally called Plaza de la Aduana (Customs Square), then Plaza del Palacio (Palace Square) and later Plaza Intendencia (Intendancy Square), is the most important civic square in Valparaíso, which was built over previous sealand. The history of the city lays in it, consisting of buildings from different periods that merge into one big area. It didn't always have a trapezoid shape as it does today, which helps to create a different perspective effect, neither had the decisive axis between the main building — the former intendancy building — nor its view of the ocean. Originally, it was an esplanade in which filthy water descended sluggishly through San Agustín (Tomás Ramos) gorge, standing next to the current Plaza de la Justicia (Justice Square). Also, a large house near to Cerro Cordillera (Cordillera Hill) played the role of customs.
On 10 June 1825 a storm broke the cables of the frigate Valdivia and stranded her on the beach that existed here. The authorities filled the hulk with sand in order to use it as a base for Valparaiso's first wharf for passengers and light cargo. Subsequently, in 1831, the passengers’ wharf started to be built, whose remains can be seen today at the museum right under the square.
After the construction of the first customs building, the most representative building of the city for almost seventy years, a square started to be built next to it. Although it was smaller and the building line was several meters ahead of the current facades, in the mid-century the latter was extended to Condell Street. In addition, some warehouses were built around it and also hotels and inns.
In 1855 came into existence in this square the first bank in Chile called the Banco de Depósitos y Descuentos de Valparaíso (The Deposits and Discounts Bank of Valparaíso), occupying part of the current square in front of the land of the present National Council of Culture and the Arts. The Bolsa de Comercio building was constructed with wood and cane from Guayaquil in 1858 and designed by the architect Juan Berg, who created a porch to access the city from the sea. The Bolsa de Comercio was inaugurated in the same year, 6 May with a special ceremony led by the President of Chile, Manuel Montt. Additionally, in the year 1866, the city of Valparaíso was bombed by the Spanish Navy during the Chincha Islands War originating from a trade dispute between Spain and Peru. Although Spain tried to burn down the Bolsa de Comercio, the building survived the attack and it was repaired afterwards. The construction of the first Post Office, next to the Bank in the corner of the Aduana (Prat) Street, and the fire department building, between Blanco and Cochrane Streets, both dating from 1868, contributed decisively to the characterization of the square as a civic one. These were neoclassical buildings that would be later replaced in the first half of the 20th century by modern architecture but preserving its early use.
In 1873, the square was already cobbled when the first sculpture of Valparaíso was built in 12 April, commemorating the Scottish seamen Lord Thomas Cochrane. In 1876, the railway crossed around the shore in front of the wharf and went from the current Errázuriz Street towards the Barrio Puerto (Port's Neighbourhood). In the same year, the construction of the Rose Company building took place, which was called Innes, and then Grace, whose facades remained until today as part of the Compañía Sudamericana de Vapores’ building. In 1885, the Bolsa de Comercio (The Stock Exchange) located in Valparaíso square right in front of the Hotel Reina Victoria (Queen Victoria Hotel) had to be demolished to install in its place the great monument to the fallen heroes in the Battle of Iquique and the crypt of the remains of Arturo Prat and his men, which would be inaugurated on 21 May 1886. The following year, a neoclassical building was built on the grounds of the current port station that was meant to serve as the administration of the Navy and other public uses, and would remain so until 1920. In 1883, a comfortable passengers’ wharf was ordered to be built. Made of wood and metal with hexagonal shape, this passengers’ wharf also known as Muelle Prat (Prat wharf), would last until 1912 when it was swept away by a storm. Until the early 20th century there was still a building in front of the Queen Victoria Hotel occupying part of the Estación Puerto (Port Station) and the customs building, which were built in the 30s.
In 2000, the Ministry of Housing and Urban Development (es) inaugurated the work of remodeling the square, directed by the architect Harken Jensen, where a concession was granted for subterranean parking lots, and additionally, a museum was inaugurated due to archeological findings in the same place. In 2004, the design of the square extends to the Prat Wharf, turning it into a touristic walkway from which was possible to embark in order to cross the roadstead of Valparaíso from the sea. At the Prat wharf is possible to see a replica of the Santiaguillo (es), a small sailing boat which was the first Spaniard vessel to dock in this bay called Quintil.
The first wharf completed in 1883 corresponds to the passengers’ wharf, made of wood and metal with hexagonal shape.
",H4ubSTbctL4w,https://img.icons8.com/?size=150&id=H4ubSTbctL4w,,#faee75,#645f2e
